{
  "skill": "cathygo.problem_set",
  "version": "0.1",
  "status": "ok",
  "mode": "single",
  "pages": [
    {
      "pageIndex": 0,
      "imageId": "page_0",
      "width": 900,
      "height": 600,
      "mimeType": "image/png",
      "sourcePath": "/Users/guanyuhong/CathyGO/cathygo-learning-skills/skills/cathygo-problem-segment/examples/single-page.layout.json"
    }
  ],
  "problems": [
    {
      "id": "problem_1",
      "number": "1",
      "section": null,
      "type": "unknown",
      "pageSpan": [
        0
      ],
      "textMarkdown": "1. 小舟从码头 A 出发，求 x 的值。",
      "textPlain": "1. 小舟从码头 A 出发，求 x 的值。",
      "elementRefs": [
        {
          "pageIndex": 0,
          "elementId": "layout_0_0"
        }
      ],
      "screenshotCandidates": [
        {
          "id": "problem_page_0",
          "role": "problem_crop",
          "title": "题目 P1",
          "source": {
            "imageId": "page_0",
            "pageIndex": 0,
            "bbox": {
              "x": 0.08,
              "y": 0.1,
              "width": 0.8,
              "height": 0.1,
              "unit": "normalized"
            }
          },
          "provenance": {
            "kind": "problem_page_union",
            "elementIds": [
              "layout_0_0"
            ]
          }
        }
      ],
      "continuedFrom": null,
      "continuesTo": null
    }
  ],
  "diagnostics": {
    "inputPageCount": 1,
    "effectiveMode": "paper",
    "problemCount": 1,
    "crossPageProblemCount": 0
  }
}
