{
  "skill": "cathygo.problem_set",
  "version": "0.1",
  "status": "ok",
  "mode": "stitch",
  "pages": [
    {
      "pageIndex": 0,
      "imageId": "page_0",
      "width": 900,
      "height": 600,
      "mimeType": "image/png",
      "sourcePath": "/Users/guanyuhong/CathyGO/cathygo-learning-skills/skills/cathygo-problem-segment/examples/stitch-page-1.layout.json"
    },
    {
      "pageIndex": 1,
      "imageId": "page_1",
      "width": 900,
      "height": 600,
      "mimeType": "image/png",
      "sourcePath": "/Users/guanyuhong/CathyGO/cathygo-learning-skills/skills/cathygo-problem-segment/examples/stitch-page-2.layout.json"
    }
  ],
  "problems": [
    {
      "id": "problem_1",
      "number": null,
      "section": null,
      "type": "unknown",
      "pageSpan": [
        0,
        1
      ],
      "textMarkdown": "3. 阅读材料：某社区开展志愿服务，\n\n请回答：（1）这次活动的意义是什么？",
      "textPlain": "3. 阅读材料：某社区开展志愿服务，\n请回答：（1）这次活动的意义是什么？",
      "elementRefs": [
        {
          "pageIndex": 0,
          "elementId": "layout_0_0"
        },
        {
          "pageIndex": 1,
          "elementId": "layout_0_0"
        }
      ],
      "screenshotCandidates": [
        {
          "id": "problem_page_0",
          "role": "problem_crop",
          "title": "题目 P1",
          "source": {
            "imageId": "page_0",
            "pageIndex": 0,
            "bbox": {
              "x": 0.08,
              "y": 0.72,
              "width": 0.8,
              "height": 0.12,
              "unit": "normalized"
            }
          },
          "provenance": {
            "kind": "problem_page_union",
            "elementIds": [
              "layout_0_0"
            ]
          }
        },
        {
          "id": "problem_page_1",
          "role": "problem_crop",
          "title": "题目 P2",
          "source": {
            "imageId": "page_1",
            "pageIndex": 1,
            "bbox": {
              "x": 0.08,
              "y": 0.08,
              "width": 0.8,
              "height": 0.12,
              "unit": "normalized"
            }
          },
          "provenance": {
            "kind": "problem_page_union",
            "elementIds": [
              "layout_0_0"
            ]
          }
        }
      ],
      "continuedFrom": null,
      "continuesTo": null
    }
  ],
  "diagnostics": {
    "inputPageCount": 2,
    "effectiveMode": "stitch",
    "problemCount": 1,
    "crossPageProblemCount": 1
  }
}
